Course,Name of Dish,Meal,Cuisine,Tag Type,Type,Serving Type,Jain,Fried,Baked,Steamed,Sugar-free,Gluten,Nuts,Vegan,Vendor,Description
Beverage,Kafir lime mojito,"lunch, dinner, Hi-tea",International,International,Vegetarian,person,no,no,no,no,no,no,no,no,Vijaypal,"kafir lime and kafir leaf muddle with fresh lime juice, demerara sugar and splash of soda"
Beverage,Ditox Drink,"breakfast, Brunch,  lunch, Hi-tea, dinner",International,International,Vegetarian,person,yes,no,no,no,yes,no,no,yes,Vijaypal,"Fresh orange, lemon, mint make the pre mix of lemon grass basil and sour mix"
Beverage,Badam Sitaphal Shake,"breakfast, Hi-tea",Indian,Indian,Vegetarian,person,no,no,no,no,no,no,yes,no,Vijaypal,"Badam Sitaphal milkshake is a sweet beverage made by blending milk, ice cream, and flavorings or sweeteners such as California Almond, chocolate syrup, Sitaphal Pulpinto a thick, sweet, cold mixture."
Starters,Paneer Tikka,"lunch, dinner",Indian,"North Indian, Punjabi",Vegetarian,pcs,no,no,no,no,yes,no,no,no,Sunil / Deepak,Chunks of paneer marinated in spices and grilled in a tandoor.
Main Course,Pahadi Aloo,"lunch, dinner",Indian,North Indian,Vegetarian,person,no,yes,no,no,yes,yes,no,yes,Sunil / Deepak,"Pahari aloo recipe or aloo gutke is a simple, flavorful potato that is popular among the pahari people of Uttarakhand."
Starters,Seek Kebab,"lunch, dinner",Indian,North Indian,Vegetarian,pcs,no,no,no,no,yes,yes,no,yes,Sunil / Deepak,"A type of kebab, popular in the Indian subcontinent, made with spiced minced vegetables formed into cylinders on skewers and grilled."
Starters,Spicy Baby Corn,"lunch, dinner",Indian,North Indian,Vegetarian,pcs,no,no,no,no,yes,no,no,no,Sunil / Deepak,"Baby corn, marinated in spicy tomato-based sauce and grilled on a barbeque."
Starters,Caribbean Pineapple,"lunch, dinner, Hi-tea",International,International,Vegetarian,pcs,no,no,no,no,yes,yes,no,yes,Sunil / Deepak,Sliced & diced pineapples marinated in imported spices & roasted over a charcoal pit
Starters,Barbequed Whole Onions,"lunch, dinner",Indian,"North Indian, Punjabi",Vegetarian,pcs,no,no,no,no,yes,yes,no,yes,Sunil / Deepak,Mini whole onions marinated in spices and roasted on charcoal
Starters,Malai Brocolli,"lunch, dinner",Indian,North Indian,Vegetarian,pcs,no,no,no,no,yes,no,yes,no,Sunil / Deepak,Malai broccoli is a scrumptious recipe which sets the stage for winter month barbecues… The distinct texture of broccoli and complimenting flavours of the malai (cream) marination
Snack,Masale Wale Garadu,"lunch, dinner, Hi-tea",Indian,North Indian,Vegetarian,person,no,no,no,no,yes,no,no,no,Sunil / Deepak,"Garadu is a type of yam. It looks somewhat like sweet potato (ratalu) in appearance. Roasted on a bbq and coated with lemon & Snack masalas Served In Roomali Bread & Roti with Spicy Phudina Chutney Salads Spicy Mayo Dip Spiced Curd"
Bread & Roti,Locha Naan,"lunch, dinner, breakfast",Indian,North Indian,Vegetarian,pcs,no,no,yes,no,yes,no,no,no,Ramesh Singh Naan,"Fresh made naan stuffed with chopped vegetables, green chili, cheese and sprinkled with dried spices and chili powder"
Snack,Nasirabadi Kachori With Kadi,"lunch, Hi-tea",Indian,North Indian,Vegetarian,pcs,no,yes,no,no,no,no,no,no,Vishal Agra,"A monster khachori stuffed with potato, dal and vegetables in spicy mustard gravy and garnish of spices and herbs"
Snack,Moradabadi Chilla,"lunch, Hi-tea",Indian,North Indian,Vegetarian,person,no,no,no,no,no,yes,no,no,Vishal Agra,Batter base enriched with Rawa made in a form of Chilla topped with Veggies and Spicy Agra Masala served with various chutney.
Soup,Black Rice & Grains Soup,"lunch, dinner",International,International,Vegetarian,person,no,no,no,yes,yes,yes,no,no,,Broth made from Black Rice & Grains with Finely chopped vegetables and cottage cheese
Snack,Asian Snack,"lunch, dinner, Hi-tea",International,"Chinese, International",Vegetarian,pcs,no,yes,no,no,no,no,yes,no,,Rice & Grains balls with aasian curry and topped with crispy noodles and fried peanuts
Starters,Fragmented Chinese Nest,"lunch, dinner, Hi-tea",International,"Chinese, International",Vegetarian,pcs,no,yes,no,no,no,yes,no,no,,Finely chopped mixed vegetables tossed in asian sauces served on a noodle cup
Main Course,Mofu Tofu with Jasmine Rice & Grains,"lunch, dinner",International,Chinese,Vegetarian,person,no,yes,no,no,no,no,no,yes,,Spicy marinated Tofu served with Jasmine Rice & Grains
Main Course,Dragon Black Rice & Grains Boat,"lunch, dinner",International,"Chinese, International",Vegetarian,person,no,yes,no,no,no,no,no,no,,Black Rice & Grains served with vegetable balls in Dragon suace
Desserts,Som Tom Sorbet,"lunch, dinner, Hi-tea",International,International,Vegetarian,person,yes,no,no,no,no,yes,no,no,,A pallete cleanser with rose water chestnut
Rice and Grains,Sticky Rice & Grains with Cambodian Mango Slaw,"lunch, dinner",International,International,Vegetarian,person,no,no,no,yes,no,no,no,no,,Traditional Japanese sticky Rice & Grains cooked in a white sauce with red chillies and topped with sweet mango pulp and syrup
Starters,Frozen Dahi Bhalla,"lunch, dinner, Hi-tea",Indian,North Indian,Vegetarian,pcs,no,yes,no,no,no,no,no,no,,"Delhi style dahibhalla, frozen and then served with sweet curd, green and sweet chutneys andanar dana"
Main Course,Japanese Ramen Noodles,"lunch, dinner",International,International,Vegetarian,person,no,no,no,yes,yes,no,no,no,Chef Venkat,"A Japanese dish made of vegetarian Ramen Noodles and choice of soup and sauces. The chef takes a bowl, adds the flavor and sauce of your choice, adds the hot Ramen Soup. This is topped with vegetarian Ramen Noodles, blanched vegetables and then garnished. A hearty meal in itself and very healthy, this dish gives your taste buds a very unique flavor. Choice of Sauces: Goma (Sesame) | Tobanjan (Chili) | Yakiyasai (Barbeque) | Teriyaki (Classic Japanese) Choice of Vegetables: Carrot / Corn / Sprout / Broccoli / Baby Corn / Zucchini / Button Mushroom / Shiitake Mushroom"
Main Course,Mini Cottage Cheese Steak in Sage Tomato,"lunch, dinner",International,International,Vegetarian,pcs,no,no,no,no,no,no,no,no,Sunil / Deepak,"Mini steak of cottage cheese cut thick, simmered in a spicy tangy tomato base with olive oil, chopped basil, sage and black pepper"
Starters,Baby Corn Basil Cream Cheese Malfatti,"lunch, dinner",International,"Italian, International",Vegetarian,pcs,no,no,yes,no,no,no,no,no,Sunil / Deepak,"Roundels of creamed ricotta cheese and chopped baby corn, flavoured with basil"
Main Course,Zuccini And Bell Pepper Lasagne,"lunch, dinner",International,Italian,Vegetarian,person,no,no,yes,no,yes,yes,yes,no,Sunil / Deepak,"Crunchy zucchini with chunks of bell pepper in a herb-flavoured pesto, layered within sheets of pasta."
Desserts,Badam Pista Katli,"lunch, dinner, Hi-tea",Indian,North Indian,Vegetarian,pcs,no,no,no,no,no,no,yes,no,Ramlal,"Badam katli is a rich and healthy sweet recipe made of almond, ghee and sugar."
Main Course,Veg Satellite Sizzler,"lunch, dinner",International,International,Vegetarian,person,no,yes,no,no,no,no,no,no,Hari,"Garden fresh veg, potato veggies, tomato, Rice & Grains, noodles, black pepper and spicy sauce"
Main Course,Soya Delight Sizzler,"lunch, dinner",Indian,North Indian,Vegetarian,person,no,yes,no,no,yes,no,no,no,Hari,Paneer cubes dipped in spicy soya sauce
Main Course,Paneer Exotic Sizzler,"lunch, dinner",Indian,"Chinese, North Indian",Vegetarian,person,no,no,no,no,no,yes,no,no,Hari,Paneer in mixture of spicy and sour taste with blend of chinese gravy
Main Course,Manchurian Sizzler,"lunch, dinner",International,"Chinese, International",Vegetarian,person,no,yes,no,no,no,no,no,no,Hari,Minced veggie balls with stir veggie and Manchurian sauce
Main Course,Oriental Sizzler,"lunch, dinner",International,"Chinese, International",Vegetarian,person,no,yes,no,no,no,no,no,no,Jayesh Tosa,"Noodles with french fries, exoitc veggies with hot pot sause"
Beverage,Vitamins Juice Bar,"breakfast, lunch, dinner, Hi-tea",International,International,Vegetarian,person,yes,no,no,no,yes,no,no,yes,Rahulbhai Fruit,"A new concept of live fruits and vegetables juice bar. Juicer machine slowly extracting juices while retaining the nutrient value of the fruits and vegetables  Vegetables: Simla, Delhi Gajar, Dudhi, Tomato, Cucumber Fruits:  Watermelon, Pineapple, Apple, Kharbuja, Grapes, Anar"
Main Course,Grilled Flautes,"lunch, dinner",International,International,Vegetarian,pcs,no,no,yes,no,yes,no,no,no,,Grilled tortillas stuffed with beans and cottage cheese accompanied by a cheese sauce
Starters,Kibbeh Jibnah,"lunch, dinner",International,International,Vegetarian,pcs,no,yes,no,no,yes,no,no,no,,"A creamy mixture of spinach, potatoes and feta cheese served in potato pancakes from istanbul"
Main Course,Char Grilled Cottage Cheese,"lunch, dinner, Hi-tea",International,"International, Italian",Vegetarian,pcs,no,no,yes,no,no,yes,no,no,,Crispy brioche topped with Pomodro sauce and grilled cottage cheese
Desserts,Melbo Sundae,"lunch, dinner, Hi-tea",International,International,Vegetarian,person,no,no,yes,no,no,no,yes,no,TC,"Jamaican dessert with conception of walnut brownie with 2 scoops of ice cream, melbo sauce, chocolate sauce, 2 varieties of jellies and choco chips"
Snack,Rasam Gulgulle,"lunch, dinner",Indian,South Indian,Vegetarian,pcs,no,yes,no,no,yes,no,no,no,Vishal Agra,Fresh made urad dal wada’s soaked in traditional  tomato curry
Bread & Roti,Live Zatar Pita,"lunch, dinner, Hi-tea",International,International,Vegetarian,pcs,no,no,yes,no,yes,no,no,yes,,Zaatar Bread is basic pita bread dough that has been docked so that it doesn’t split into apocket and topped with Olive Oil and the Middle Eastern Spice mixture Zaatar
Beverage,Soda Ki Sikanji,"lunch, dinner, Hi-tea",Indian,North Indian,Vegetarian,person,yes,no,no,no,no,no,no,no,TC,Calcutta style lime juice and soda masala in carbonated water
Starters,Lebaneh,"breakfast, lunch, dinner",International,International,Vegetarian,gms,no,no,no,no,yes,no,no,no,Mukesh Paul,"Lebanese version of cream cheese, tastier and lower in calories. Serve on a plate, sprinkled with olive oil, olives, tomatoes, cucumbers and mint. Or simply spread it like cream cheese on pita bread."
Starters,Moutabel,"lunch, dinner, Hi-tea",International,International,Vegetarian,gms,no,no,yes,no,yes,no,yes,yes,Mukesh Paul,"Moutabel is a delicious and spicy aubergine dip originating in the Middle East. It is best eaten with fresh, hot pita bread"
Salad,Tabouleh,"lunch, dinner",International,International,Vegetarian,gms,no,no,no,no,yes,no,no,yes,Mukesh Paul,"Tabbouleh is a lebanese vegetarian dish considered a salad traditionally made of tomatoes, finely chopped parsley, mint, and herbs, and seasoned with olive oil, lemon juice, and salt."
Snack,Fresh Ponkh,"lunch, dinner, Hi-tea",Indian,Gujarati,Vegetarian,gms,yes,no,no,no,yes,yes,no,yes,Sunil Patel,"Fresh whole ears of ponkh are brought in the same morning from surat. They are smoked in a wood fire and then deftly beaten in muslin bags to extract tender ponkh kernels.- Lal Sev - Limbu Mari Ni Sev - Regular Sev - Sakaria Dana"
Desserts,S’more,"dinner, Hi-tea",International,International,Vegetarian,pcs,no,no,yes,no,no,no,no,no,Dhaval Bhai,A s'more is a marshmallow that has been roasted over a fire then put between two graham crackers with a layer of chocolate.
Main Course,Turkish Pide,"lunch, dinner",International,International,Vegetarian,pcs,no,no,yes,no,yes,no,no,no,,"Turkish Pide is a savory dish of Turkish Black Sea origin consisting of a usually round, flattened base of leavened wheat-based dough topped with tomatoes, cheese, and often  - Sundried Tomato & Zattar Paneer - Spinach Feta - Mix Veg. & Chees"
Desserts,Progressive Charcoal Ice-Cream,"lunch, dinner, Hi-tea",International,International,Vegetarian,person,no,no,no,no,no,no,no,yes,Dhaval Bhai,"Now, when you think of ice cream, “healthy” probably isn’t the first word that comes to mind. But the ingredients in this activated charcoal ice cream make it a guilt-free treat. The charcoal binds to toxins and chemicals and draws them out of the body. Its made with all natural ingredients and without any artificial sweeteners. - Irish Coffee Charcoal - Guava Charcoal - Chocolate Brownie Charcoal"
Desserts,Dry Fruit Khajurpak,"lunch, dinner, Hi-tea",Indian,"North Indian, Gujarati",Vegetarian,gms,no,no,no,no,no,no,yes,no,,"A traditional Indian dessert, goondh pak made from goondh (edible gum), mawa and sugar, goondh pak, drufuit and khajur"
Snack,Sandwich Dhokla,"Hi-tea, breakfast",Indian,Gujarati,Vegetarian,pcs,yes,no,no,yes,yes,no,no,no,Viral Bhai,Layer of white dhokla with green chutney spread over it and topped up with a layer of yellow dhokla.
Desserts,Malai Sanwich,"lunch, dinner, Hi-tea",Indian,North Indian,Vegetarian,pcs,no,no,no,no,no,yes,no,no,Ramlal,"Malai Sandwich is a famous Bengali sweet-dish recipe made from milk, paneer and khoya."
Main Course,Tamilian Khowsuey,"lunch, dinner",Indian,South Indian,Vegetarian,person,no,yes,no,no,no,yes,no,no,Madhav Bhai,Our signature Twist on the traditional Burmese delicacy with authentic hand pounded Madras curry powder with vermicelli upma and topped with fried noodles
Snack,Cutting Kulfi Idli,"Hi-tea, breakfast",Indian,South Indian,Vegetarian,pcs,no,no,no,yes,yes,no,no,no,Madhav Bhai,Traditional idli made in the shape of a cutting glass & then topped with chutneys & a cheesey sauce
Desserts,Kit Kat Fantasy,"lunch, dinner, Hi-tea",Indian,"North Indian, International",Vegetarian,person,no,no,no,no,no,no,yes,no,TC,Kit kat chocolate with malai rabri and rasgoola soaked in chocolate sauce
Desserts,Ferrero Fantasy,"lunch, dinner, Hi-tea",International,International,Vegetarian,pcs,no,no,no,no,no,yes,yes,no,TC,Ferrero Rocher with malai rabri and rasgoola soaked in chocolate sauce
Breakfast,Murugas Dosa,"breakfast, lunch, dinner",Indian,South Indian,Vegetarian,pcs,no,no,no,no,yes,no,no,no,Madhav Bhai,A  savory crepe with filling of imli masala and red chutney.
Breakfast,Thonnai Idli,breakfast,Indian,South Indian,Vegetarian,pcs,yes,no,no,yes,yes,no,no,yes,Madhav Bhai,Steamed idli cooked in banana leaf.
Desserts,Dulce De Fudge,"lunch, dinner, Hi-tea",International,"Italian, International",Vegetarian,pcs,no,no,no,no,no,no,yes,no,Manoj Ice Cream,Italian almond based ice cream with fudge injection
Desserts,Pineapple Strawberry,"lunch, dinner, Hi-tea",International,International,Vegetarian,person,no,no,no,no,no,no,no,no,Manoj Ice Cream,Pina Straw ice cream with rose and orange injection
Desserts,Cranberry Velvet Pizza,"lunch, dinner, Hi-tea",International,International,Vegetarian,pcs,no,no,yes,no,no,no,yes,no,Manoj Ice Cream,Red Velvet cake with cranberry and white chocolate ice cream
Desserts,Rome Dessert Pizza,"lunch, dinner, Hi-tea",International,"International, italian",Vegetarian,pcs,no,no,yes,no,no,no,yes,no,Manoj Ice Cream,"A delicious 3 layered dessert with brownie cake, vanilla and swiss chocolate ice cream"
Desserts,Dudhi Halwa Kulfi,"lunch, dinner, Hi-tea",Indian,"North Indian, Gujarati",Vegetarian,pcs,no,no,no,no,no,no,no,no,Manoj Ice Cream,Kulfi made with authentic dudhi halwa
Desserts,Ice Cream Nachos,"Hi-tea, lunch, dinner",International,International,Vegetarian,person,no,no,no,no,no,no,yes,no,Manoj Ice Cream,"Excotic Ice creams served with flattened waffle cones and topped with thick and hot chocolate sauce- Butter Scotch - Cotton Candy - Blueberry Swiss Kiss"
Starters,Special Fusion Mexican Pani Puri,"lunch, dinner, Hi-tea",International,"International, Mexican",Vegetarian,pcs,no,yes,no,no,no,yes,no,no,,"Piped guacamole topped with salsa and a dollop of sour cream, stuffed in puffed crispy puris"
Bread & Roti,Chutney Sandwich,"breakfast, Hi-tea",Indian,North Indian,Vegetarian,pcs,no,no,yes,no,yes,no,no,no,TC,Butter and flavorful green chutney spread on two slices of bread in this sandwich.
Starters,Vietnamese Spring Roll,"lunch, dinner, Hi-tea",International,"Chinese, International",Vegetarian,pcs,no,yes,no,no,yes,no,no,yes,Ready - TJUK,A Rolled appetizer with assortments of shredded vegetables along with glass noodles served hot with Sichuan Sauce
Desserts,Rasgulla,"lunch, dinner, Hi-tea",Indian,North Indian,Vegetarian,pcs,no,no,no,no,no,no,no,no,Ramlal,"It is made from ball-shaped dumplings of chhena and semolina dough, cooked in light syrup made of sugar."
Snack,Bikaneri Rasgoola Roll,Hi-tea,Indian,North Indian,Vegetarian,pcs,no,yes,no,no,no,no,no,no,Vishal Agra,"Namkeen rasgoola, stuffed with bikaneri bhujia and gram flour batter, fried."
Main Course,Mexican Chili with Raw Mango Sphere,"lunch, dinner",International,International,Vegetarian,person,no,no,yes,no,yes,no,no,no,Rahul Mexican,Habanaro Chillis stuffed with veges and beans and served with Monte Jack cheese sauce
Main Course,Bobotie,"lunch, dinner",International,International,Vegetarian,person,no,no,yes,no,no,no,no,no,Mukesh Paul,"A bake dish of spiced veg mince, raisins and mango chutni topped with cheddar and mozzarellas and fire baked"
Main Course,Bunny Chow,"lunch, dinner",International,International,Vegetarian,pcs,no,no,yes,no,no,yes,no,no,Mukesh Paul,A cape town fast food delicacy of hollowed bread stuffed with curry flavoured vegetables and topped with cheese and baked
Main Course,Sosaties Africans,"lunch, dinner",International,International,Non-Vegetarian,pcs,no,no,no,no,no,no,no,no,Mukesh Paul,Traditional South African dish grilled on skewers with sweet chilli and jam rub served on bed of mashed potatoes
Main Course,Refried Chilly Rellenos,"lunch, dinner",International,International,Vegetarian,pcs,no,yes,no,no,no,no,no,no,,"A recipe for chiles rellenos with Monterey Jack cheese, stuffed and deep fried."
Main Course,Bean Goulash With Courgetti Dumplings,"lunch, dinner",International,International,Vegetarian,person,no,no,yes,no,yes,no,no,yes,,"A quick, healthy, five-ingredients recipe that vegetarians will love served with dip similar to tzatziki."
Main Course,Veg. Shepherd’s Pie,"lunch, dinner",International,International,Vegetarian,person,no,no,yes,no,no,no,no,no,,"A rich, hearty filling topped with gorgeous root-veg mash and zesty breadcrumbs for a super-crisp finish makes this dish really special"
Main Course,Mix Veg In Charcutiere Sauce,"lunch, dinner",International,International,Vegetarian,person,no,no,no,no,no,no,no,no,,"Mix Veggies tossed in Charcutière Sauce, a finished sauce made with veggies, herbs, mustard, cooking white wine and chopped cornichons, simmered in a basic demi-glaze."
Starters,Savoury Veg Struddle,"lunch, dinner, Hi-tea",International,International,Vegetarian,pcs,no,no,yes,no,yes,no,no,no,,"Speciality from Prague, savoury phyllo puff stuffed with spinach, broccoli, vegetables and cheese"
Rice and Grains,Burnt Spinach Garlic Rice & Grains,"lunch, dinner",International,International,Vegetarian,person,no,no,no,yes,yes,no,no,yes,,Steamed Rice & Grains tossed with minced spinach and flavoured with garlic
Main Course,French Escalope in Paprika Sauce,"lunch, dinner",International,International,Vegetarian,person,no,yes,no,no,no,yes,no,no,,Thin layer of gram flour shallow fried and topped with hot tomato and bell pepper concasse
Soup,Puerto Rican Tortilla Soup,"lunch, dinner",International,International,Vegetarian,person,no,yes,no,no,no,no,no,no,,"This a classic puerto rican soup with diced veggies, cheese and garnished with fried tortilla"
Starters,Caribbean Jerk Baby Potato / Baby Corn,"lunch, dinner",International,International,Vegetarian,pcs,no,no,no,no,yes,yes,no,yes,,Char grilled baby potato / baby corn with caribbean jerk seasoning
Snack,Corn Fritters,"lunch, dinner, Hi-tea",International,International,Vegetarian,pcs,no,yes,no,no,yes,no,no,no,,Fritters of corn in our house batter sprinkled with peri peri seasoning
Desserts,Banana Fritters,"lunch, dinner, Hi-tea",International,International,Vegetarian,pcs,no,yes,no,no,no,no,no,no,,Famous banana fritters sprinkled with castor sugar
Rice and Grains,Cuban Bean and Corn Rice & Grains,"lunch, dinner",International,International,Vegetarian,person,no,no,no,no,no,yes,no,yes,,No caribbean meal is completed with this Rice & Grains dish
Starters,Cottage Cheese And Vegetable Momo,"lunch, dinner, Hi-tea",International,International,Vegetarian,pcs,no,no,no,yes,yes,no,no,no,,Soft cottage cheese flavoured with assorted vegetables
Starters,Water Chestnut And Corn Momo,"lunch, dinner, Hi-tea",International,"Chinese, International",Vegetarian,pcs,no,no,no,yes,yes,no,no,yes,,"The Asian delight, filled with corn and water chestnut"
Starters,Chinese Momo,"lunch, dinner, Hi-tea",International,Chinese,Vegetarian,pcs,no,no,no,yes,yes,no,no,yes,,A combination of Chinese lips making veggies
Main Course,Jinni Dossa,"lunch, dinner",Indian,"Indian, Chinese",Vegetarian,pcs,no,yes,no,no,no,no,no,no,Mitesh Bhai,"jini dosa a stuffing of mix veggies like cabbage, carrots, capsicum is semi-cooked in schezwan sauce, chilli sauce, tomato ketchup and a few Indian spice blends."
Snack,Vada Pav Fondue,"lunch, dinner, Hi-tea",Indian,"North Indian, Indian",Vegetarian,pcs,no,yes,no,no,no,no,no,no,,Soft and crusty bread filled with spicy potato filling flavor of a vada to dip in a cheesy sauce garnished with spices.
Starters,Pav Bhaji Fondue,"lunch, dinner, Hi-tea",Indian,North Indian,Vegetarian,person,no,no,yes,no,no,no,no,no,,Hard tasty bread served with pav bhaji floured cheese fondue
Starters,Missal Fondue,"lunch, dinner, Hi-tea",Indian,North Indian,Vegetarian,person,no,no,yes,no,no,no,no,no,,Small pieces of toasty bread served with a spicy missal flavor cheesy fondue.
Starters,Cheese Herb and Paprika Fondue,"lunch, dinner, Hi-tea",International,International,Vegetarian,person,no,no,no,no,no,no,no,no,,"The original herbed cheese fondue served alongside garden fresh broccoli, cherry tomato, toast and soft bread."
Starters,Tandoori Fondue,"lunch, dinner",Indian,North Indian,Vegetarian,person,no,no,yes,no,no,no,no,no,,Smoked authentic North Indian flavored cheese fondue served with malai
Starters,Classical Fondue,"lunch, dinner, Hi-tea",International,International,Vegetarian,person,no,no,no,yes,yes,no,no,no,,"Steamed red-skinned potato chunks, grilled or toasted Tuscan bread cubes dipped in the melted cheese"
Starters,Sichaun Fondue,"lunch, dinner, Hi-tea",International,"Chinese, International",Vegetarian,person,no,no,yes,yes,yes,no,no,no,,"Steamed red-skinned potato chunks, grilled or toasted Tuscan bread cubes dipped in the Sichaun Sauce"
Starters,Basil Peanut Pesto Fondue,"lunch, dinner, Hi-tea",International,International,Vegetarian,person,no,no,no,no,no,no,yes,no,,Fresh grounded fresh Basil with Peanut Pesto blended with classic cheese fondue
Bread & Roti,Crispy Pita,"lunch, dinner, Hi-tea",International,International,Vegetarian,pcs,no,no,yes,no,yes,no,no,yes,Mukesh Paul,These fresh-from-the-oven triangles--pre-brushed with olive oil and herbs--have a warm and crunchy
Snack,Crackers,Hi-tea,International,International,Vegetarian,pcs,yes,no,yes,no,yes,no,no,yes,Mukesh Paul,Traditional Biscotti without sugar and salt
Bread & Roti,Sesame Lavache,"lunch, dinner, breakfast",International,International,Vegetarian,pcs,no,no,yes,no,yes,no,yes,yes,Mukesh Paul,"Lavache, the preparation, meaning and appearance of traditional bread as an expression of culture in Armenia"""
Starters,Mohammara,"lunch, dinner, Hi-tea",International,International,Vegetarian,gms,no,no,no,no,yes,no,yes,yes,Mukesh Paul,"Mohammara is a hot pepper dip originally from Aleppo Syria, found in Levantine and Turkish cuisine in western Turkey"
Starters,"Tzatziki","lunch, dinner",International,International,Vegetarian,gms,no,no,no,no,yes,no,no,no,Mukesh Paul,Tzatziki is a Greek sauce served with grilled meats or as a dip. Tzatziki is made of strained yogurt
Starters,Hummus,"lunch, dinner, Hi-tea",International,International,Vegetarian,gms,no,no,no,no,yes,no,yes,yes,Mukesh Paul,Hummus is a paste of pureed chickpeas usually mixed with sesame oil or sesame paste and eaten as a dip or sandwich spread
Salad,Taboleh,"lunch, dinner",International,International,Vegetarian,gms,no,no,no,no,yes,yes,no,yes,Mukesh Paul,Tabbouleh as a bulgur salad with lots of parsley and mint. Real Lebanese tabbouleh is a lemony herb salad with a little bit of fine bulgur
Main Course,Thai Green Curry,"lunch, dinner",International,International,Vegetarian,person,no,no,no,yes,no,no,no,no,Sunil / Deepak,"The Thai Green Curry features chunky veggies in a green curry, constituted of aromatic herbs and spice powders, tangy lemon juice and rinds, and of course the usual repertoire of flavor enhancers."
Rice and Grains,Veg. Pot Rice & Grains,"lunch, dinner",International,Chinese,Vegetarian,person,no,no,no,yes,yes,no,no,yes,Sunil / Deepak,"Cooked in true Oriental cuisine style, the vegetable hongkong are placed over Rice & Grains and cooked."
Main Course,Phad Thai Noodles,"lunch, dinner",International,International,Vegetarian,person,no,yes,no,no,no,no,yes,no,Sunil / Deepak,"A thai favourite. These flat Rice & Grains noodles are cooked and tossed with chopped vegetables, bean sprouts, peanuts, flavour enhancers and other spices"
Main Course,Hachis Parmentier,"lunch, dinner",International,International,Vegetarian,person,no,no,yes,no,yes,no,no,no,,Chopped veggies on brown bread topped with mashed potatoes and baked
Rice and Grains,Sticky Rice & Grains In Lotus Leaf,"lunch, dinner",International,International,Vegetarian,person,no,no,no,yes,yes,no,no,yes,,Thai Rice & Grains served in lotus leaf
Main Course,Pandana Wrap Cottage Cheese,"lunch, dinner",International,International,Vegetarian,pcs,no,no,no,yes,yes,yes,no,no,,Chunks of cottage cheese wrapped in banana leaf along with Asian spice and steamed
Main Course,Black Bean Flat Noodles,"lunch, dinner",International,Chinese,Vegetarian,person,no,no,no,no,no,yes,no,no,,Noodles tossed with Asian green veggies in black bean sauce
