Course,Name of Dish,Meal,Cuisine,Tag Type,Type,Serving Type,Jain,Fried,Baked,Steamed,Sugar-free,Gluten,Nuts,Vegan,Vendor,Description
Snack,Loaded Potato Snack,"lunch, dinner, Hi-tea",Indian,North Indian,Vegetarian,pcs,no,no,yes,no,yes,no,no,no,Rahul Mexican,Loaded Potato stuffed with our spiced cottage cheese with and pickled onion.
Starters,Fusion Falafel,"lunch, dinner, Hi-tea",International,International,Vegetarian,pcs,no,yes,no,no,no,no,no,no,Rahul Mexican,"Pani puri stuffed with Tabouleh, falafel crumbs, Hummus & Harissa sauce and served on shot glass with Tahina sauce"
Desserts,Handmade Ice Cream,"lunch, dinner, Hi-tea, breakfast",International,International,Vegetarian,person,no,no,no,no,no,no,yes,no,Dhaval Bhai,"Ice Cream made in the hand sancha using the best quality of ingredients be it the dry fruits, fresh fruits or the milk products. Trupti Caterers give you one of the most exotic combinations of flavors specially made for your occasion."
Snack,Kolkata Paan ki Snack,Hi-tea,Indian,North Indian,Vegetarian,pcs,no,yes,no,no,no,no,no,no,Vishal Agra,Paan Chat is basically deep fried Bettlenut leaves topped with Chutneys and sweet Dahi along with a dash of Snack Masala.
Beverage,Mixlogy And Molecular Mocktail Bar,"lunch, dinner, Hi-tea",International,International,Vegetarian,person,yes,no,no,no,no,no,no,yes,Salman Mocktail,"A cocktail-style beverage made without alcoholic ingredients, a smooth blend of fresh fruit juices, syrups, cream, herbs and spices. A perfect way for the whole family to enjoy the refreshments. -  Basil Bay -  Tropical Daylight -  Winter Berry -  Orange Sunrise -  Green Apple Lemonade -  Kokam Lemonade -  Masala Lemonade -  Pink Panther -  Masala Mojito -  Classic Virgin Mojito A stylish theme based mocktail bar is set up on site & professional bartenders make these delicious & refreshing drinks. These are then served in a variety of different glassware and served to the guests on the bar & circulated as well."
Bread & Roti,Roasted Vegetables Focaccia Bread Sandwich,"lunch, dinner, Hi-tea",International,International,Vegetarian,pcs,no,no,yes,no,no,yes,no,no,Ankush Bakery,"Vegetable Sandwich is a crispy, crunchy sandwich loaded with all types of vegetables"
Snack,Moongdal Dhokla With Peas & Corn,"Hi-tea, breakfast",Indian,"Gujarati, North Indian",Vegetarian,pcs,yes,no,no,yes,yes,no,no,yes,Viral Bhai,"Dhokla is a vegetarian culinary dish that is made with a fermented batter derived from legumes like Chickpea, Pigeon pea and Urad and Rice & Grains."
Desserts,Manglik Lapasi,"lunch, dinner",Indian,North Indian,Vegetarian,gms,no,no,no,no,no,yes,yes,no,Venji Maharaj,"This is made using grain flour or broken wheat and ghee, along with milk, nuts, raisins and other dried fruits"
Snack,Chana Jor Garam,Hi-tea,Indian,North Indian,Vegetarian,gms,yes,no,no,no,yes,no,no,yes,,"A common street snack in most Indian states, made from flattened chickpeas that are roasted and spiced"
Snack,Live Potato Twisters,"lunch, dinner, Hi-tea",International,"International, Korean",Vegetarian,pcs,no,yes,no,no,yes,no,no,yes,,"Tornado potatoes, also called twist potatoes or tornado fries, are a popular street food in South Korea. It is a deep fried spiral-cut whole potato on a skewer, brushed with various seasonings such as onion, cheese, or honey."
Beverage,Fresh Sugarcane Juice Counter,"lunch, dinner, Hi-tea",Indian,North Indian,Vegetarian,person,yes,no,no,no,yes,yes,no,yes,Rahulbhai Fruit,"Nectar extracted by crushing sugarcane between two rumblers. Mix it up with lemon, ginger and Snack masala to quench your thirst even on the hottest of days"
Snack,Live Popcorn Counter,"lunch, dinner, Hi-tea, breakfast",International,International,Vegetarian,gms,no,no,no,no,no,no,no,no,,"Popcorn is a variety of corn kernel which expands and puffs up when heated Flavours:-  Butter Salted-  Caramel-  Cheese Tomato"
Snack,Live Bhutta Counter,"lunch, dinner, Hi-tea",Indian,North Indian,Vegetarian,pcs,yes,no,no,no,yes,yes,no,yes,Rahulbhai Fruit,"Masala Butta or Spiced fire roasted corn on the cob is a favorite street snack in India when corn is in season. Whole corn cobs are roasted over a charcoal grille and smeared with lemon, salt and chili seasoning."
Desserts,Candy Floss Burrito Ice Creams,Hi-tea,International,International,Vegetarian,pcs,no,no,no,no,no,no,no,no,Dhaval Bhai,"Cotton candy is a form of spun sugar. Which is stuffed with ice-cream sprinkles and sewed in Rolls -  Mandarin Orange -  Bubblegum"
Beverage,Cold Press Juices Bar,"breakfast, lunch, dinner, Hi-tea",International,International,Vegetarian,person,yes,no,no,no,yes,no,no,yes,,"Cold-pressed juice refers to juice that uses a hydraulic press to extract juice from fruit and vegetables, as opposed to other methods such as centrifugal or single auger -  Assorted vegetables & fruits"
Snack,Sweet Corn Ki Snack,"lunch, Hi-tea",Indian,North Indian,Vegetarian,gms,no,no,no,no,yes,no,no,no,Sunil / Deepak,"Sweet Corn Snack is a super quick snack made with boiled corn, Snack masala, spice powder, herbs and tomatoes."
Snack,Live Fries Station,"lunch, dinner, Hi-tea",International,International,Vegetarian,person,yes,yes,no,no,yes,no,no,no,,"ALLETE-cut deep-fried potatoes, originating from either Belgium or France. They are prepared by cutting the potato into even strips, then drying and frying it, usually in a deep fryer -  French Fries -  Jain Fries Served with 6 Types of Dips"
Snack,Old School Counter,Hi-tea,Indian,"Gujarati, North Indian",Vegetarian,gms,yes,no,no,no,yes,no,no,yes,,"Relive your childhood memories with this exclusive counter - Assorted Aamla - Assorted Bor - Green Variyali - Chinia Minia - Star Fruit - White Jamun - Red Jamun - Raw & Ripe Imli - Khatai - Boiled Sing- Kachi Keri - Karond"
Main Course,Sri Lankan Curry Idli,"breakfast, lunch",Indian,International,Vegetarian,person,no,no,no,yes,yes,no,no,no,Mitesh Bhai,"The homeliest of Sri Lankan recipes, small Idlis are dipped in a Sri Lankan style coconut milk based stew & served hot"
Main Course,Exclusive Mango Counter,"lunch, dinner",International,International,Vegetarian,person,no,yes,no,yes,no,no,no,no,,"-  Charcoal Toastada with Mango Salsa -  Tropical Mango Vietnamese Spring Rolls -  Egyptian Falafel With Mango Tabouleh -  Thai Mango Curry With Burnt Butter Rice & Grains"
Starters,Sri Lankan Curry Vada,"lunch, dinner",International,International,Vegetarian,pcs,no,yes,no,no,yes,no,no,no,Mitesh Bhai,"The homeliest of Sri Lankan recipes, small vadas are dipped in a Sri Lankan style coconut milk based stew & served hot"
Main Course,Dhaba Style Cheese Paneer,"lunch, dinner",Indian,"North Indian, Punjabi",Vegetarian,person,no,no,no,no,no,no,yes,no,Venji Maharaj,Chunks of marinated cottage cheese in a tomato & cashew nut based gravy infused with melted cheese to give it a very distinct flavour
Main Course,Paneer Ambariya,"lunch, dinner",Indian,North Indian,Vegetarian,person,no,no,no,no,no,no,no,no,Venji Maharaj,Pieces of cottage cheese in a tomato & bell pepper based gravy with strong flavours of traditional Indian spices
Main Course,Veg Bhuna Masala,"lunch, dinner",Indian,"North Indian, Punjabi",Vegetarian,person,no,yes,no,no,no,no,no,no,Venji Maharaj,Finely chopped and mashed vegetables in a semi dry Lahori style gravy
Rice and Grains,Veg Bhuna Biryani,"lunch, dinner",Indian,North Indian,Vegetarian,person,no,no,no,no,no,no,no,no,Venji Maharaj,A traditional biryani made with finely chooped and mashed vegetables in a semi dry lahori style gravy
Main Course,Kolhapuri Rassa Vada,"lunch, dinner",Indian,North Indian,Vegetarian,person,no,yes,no,no,no,no,no,no,Bhalerao Kunal,"Traditional Khopoli style vada topped with spicy usal & garnished with herbs, tomatoes & a dash of lime"
Main Course,Bubble Pizza,"lunch, dinner",International,"Italian, International",Vegetarian,pcs,no,no,yes,no,no,yes,no,no,Mitesh Bhai,"Traditional pizza dough flattened and stuffed with vegetables, concasse & cheese, then topped with another layet of pizza dough & cooked in a modified waffle machine."
Desserts,Live Imarti,"lunch, dinner, Hi-tea",Indian,North Indian,Vegetarian,pcs,no,yes,no,no,no,no,no,no,Ramlal,"It is made by deep-frying vigna mungo flour batter in a circular flower shape, then soaking in sugar syrup"
Desserts,Fresh Strawberry with Cream,"lunch, dinner, Hi-tea",Indian,Indian,Vegetarian,person,no,no,no,no,no,no,no,no,Rahulbhai Fruit,"Strawberry and cream dessert recipe is a famous dessert recipe from Mahabaleshwar prepared using fresh strawberries, whipped cream, ice cream and strawberry pulp"
Pasta,Handmade Pasta,"lunch, dinner",International,"Italian, International",Vegetarian,person,no,no,yes,no,no,yes,no,no,Rahul Mexican,"Choice Of Pasta- Spinach Ravioli - Tortellini under Ground - Penne Choice Of Sauces - Grilled Pepper Arbiaatta - Basil Pesto - Mornay Inviolate - Butter Crisp Herbs, Chilli Flakes, Peppers, Oregano, Tomato Cream Sauce, Chili, Sun Dried Tomato Thyme, Celery Cream Add Vegetables of Your Choice - Baby Corn, Peppers, American Corn, Zucchini, Chopped Herbs, Vegetables & Beans Toppings - Oven Dried Tomato, Caramelized Veggies, Crispy, Chilli Oil, Herb Oil.Herb Bread"
Bread & Roti,Georgian flat Bread (Kacha puri),breakfast,International,International,Vegetarian,pcs,no,no,yes,no,no,no,no,no,Rahul Mexican,"Georgian Flat bread (Khachapuri) is a traditional Georgian dish of cheese-filled bread. The bread is leavened and allowed to rise, molded into various shapes, and then filled in the center with a mixture of cheese."
Main Course,Achama,"lunch, dinner",International,International,Vegetarian,pcs,no,no,yes,no,yes,no,no,no,Rahul Mexican,"Achma is a Georgian dish consisting of a few layers of tender dough, and cheese in between. It originates from the western Georgian regions of Adjara and Abkhazia. This is our take on this Georgian delicacy. ‎"
Main Course,Khinkali,"lunch, dinner, Hi-tea",International,International,Vegetarian,pcs,no,no,no,yes,yes,no,no,no,Rahul Mexican,"Our take on Khinkali which is dumpling in Georgian cuisine. It is made of twisted knobs of dough, stuffed exotic vegetables and spices and drizzled with Basil compot"
Starters,Charcoal Tostada,"lunch, dinner",International,International,Vegetarian,pcs,no,yes,no,no,yes,no,no,no,Rahul Mexican,"Tostada is the name given to various dishes in Mexico and other parts of Latin America which include a toasted tortilla as the main base of their preparation. The name usually refers to a flat or bowl-shaped tortilla that is deep-fried or toasted,"
Main Course,Papusa,"lunch, dinner",International,International,Vegetarian,pcs,no,no,yes,no,yes,no,no,no,Rahul Mexican,Pupusas are a traditional dish from El Salvador and are similar to a corn pancake with bean and cheese
Snack,Eucodorian Empanadas,"lunch, dinner, Hi-tea",International,International,Vegetarian,pcs,no,yes,no,no,no,no,no,no,Rahul Mexican,"These delicious traditional Ecuadorian empanadas are filled with cheese, fried until crispy, and served sprinkled with sugar."
Bread & Roti,Scaccia,"lunch, dinner",International,"Italian, International",Vegetarian,pcs,no,no,yes,no,yes,no,no,no,Rahul Mexican,"A tomato-cheese-layered loaf with a distinct al dente pasta-like texture inside and a crusty, blistered exterior."
Main Course,Rassey Missey Chholley With Bharwaan Amritsari Kulcha,"lunch, dinner",Indian,"North Indian, Punjabi",Vegetarian,person,no,no,yes,no,no,no,no,no,ACK,"Amritsar’s favourite bread, is the kulcha named after the city. Whilst there is a string of kulcha wallahs on Maqbool road, the best practitioner of the art form, Harbans Singh, performs in a little rerhi, which he has grandiosely named Sheesh Mahal The Bake - Amritsari Kulcha comes with a variety of rich stuffings: Potato / Paneer and Green Peas and is served with chholley and chutney. - Bharwaan Amritsari Kulcha (Paneer, Chilly & Mutter Stuffing) With - Rassey Missey Chholley Chickpeas came to India with the kabuli walla, the itinerant dry-fruit trader from Afghanistan. It continues to be called the kabuli channa and this version is the perfect match for the oh! So! Heavenly Amritsari kulcha"
Bread & Roti,Puri,"breakfast, lunch, dinner",Indian,North Indian,Vegetarian,pcs,no,yes,no,no,yes,yes,no,no,Venji Maharaj,"The puri is basically a deep-fried snack made with dough. The dough is made of flour, water and salt"
Rice and Grains,Kullad Dal Chawal (Dal Tadka + Jeera Rice & Grains),"lunch, dinner",Indian,North Indian,Vegetarian,person,no,no,no,no,no,no,yes,no,Venji Maharaj,"A well known wholesome Indian meal consisting layers of dal and Rice & Grains topped with masala peanuts, papad churi, caramalised cabbage and a spoonfull of ghee"
Desserts,Stuffed Croissant,Hi-tea,International,International,Vegetarian,pcs,no,no,yes,no,no,yes,yes,no,Dhaval Bhai,A croissant is a French pastry made from puff pastry in a crescent shape. Here we stuff that croissant with fresh hand churned ice cream & serve topped with whipped cream & condiments
Desserts,Mini Hot Doughnut With Ice Cream,"lunch, dinner, Hi-tea",International,International,Vegetarian,pcs,no,yes,no,no,no,no,no,no,Dhaval Bhai,"Mini Doughnuts injected with flavours, made live. -  Served with a Selection of Ice Creams"
Main Course,Amritsari Bhuna Paneer Served With Makhmali Paratha,"lunch, dinner",Indian,"North Indian, Punjabi",Vegetarian,person,no,no,yes,no,no,yes,no,no,Venji Maharaj,"Exclusive Lahori & Amritsari style spicy dry gravy made on a tawa mixed with crushed cottage cheese topped with fresh cream.Served with enriched flaky refined flour bread cooked over griddle Accompaniments - Phudina Chutney, Mirchi Achaar"
Bread & Roti,Sicilian Paneer Roasta Sandwich,"lunch, dinner, Hi-tea",International,International,Vegetarian,pcs,no,no,yes,no,no,no,no,no,Mitesh Bhai,"Cubes of cottage cheese marinated in spicy chili sauce used a filling in a crispy, crunchy sandwich loaded with all types of vegetables"
Snack,Dum Patta Matke Ki Snack,"lunch, dinner, Hi-tea",Indian,North Indian,Vegetarian,pcs,no,no,no,yes,yes,no,no,no,Vishal Agra,"A unique blend of chickpeas, cottage cheese, curry & spices wrapped in a banana leaf. This is kept in a kullad and cooked DUM style. Served with chutneys & salads"
Starters,Paneer Chilly Samosa,"lunch, dinner, Hi-tea",Indian,North Indian,Vegetarian,pcs,no,yes,no,no,yes,no,no,no,Ready - Raj Chheda,"Mini triangular shape snack filled with Chopped Chilly, Cottage Cheese & Indian masalas"
Starters,Peri Peri Blast,"lunch, dinner",International,International,Vegetarian,person,no,yes,no,no,no,no,no,no,Ready - Raj Chheda,Peri Peri Rice & Grains mixed with lentil and spinach sauce topped with fried wonton sheets
Starters,Cheese Jalapeno Samosa,"lunch, dinner, Hi-tea",Indian,North Indian,Vegetarian,pcs,no,yes,no,no,no,no,no,no,Ready - Raj Chheda,"Mini triangular shape snack filled with Cheese, Jalapeni chilly & Indian masalas"
Starters,Pink Spaghetti Ball,"lunch, dinner",International,"italian, International",Vegetarian,pcs,no,no,yes,no,yes,yes,no,no,Ready - Raj Chheda,The Pink spaghetti balls are nothing more than cooked spaghetti noodles in a mixture that’s very similar to my Classic Lasagna ricotta filling.
Starters,Cheese Corn Potli,"lunch, dinner, Hi-tea",International,International,Vegetarian,pcs,no,no,yes,no,no,no,no,no,Ready - Raj Chheda,Crispy homemade Potli filed with creamed cheese and corn baked and served hot
Starters,Cheese Spinach Tart,"lunch, dinner, Hi-tea",International,International,Vegetarian,pcs,no,no,yes,no,no,no,no,no,Ready - Raj Chheda,Crispy homemade tart filed with creamed cheese and Spinach baked and served hot
Starters,Smoky Paneer Nest,"lunch, dinner",Indian,North Indian,Vegetarian,pcs,no,no,yes,no,yes,yes,no,no,Ready - Raj Chheda,"Smoky Paneer nest made with Flour and water, then coat in Crushed Cottage Cheese stuffed in like a nest."
Starters,Paneer Fresta,"lunch, dinner",Indian,North Indian,Vegetarian,pcs,no,no,yes,no,no,no,no,no,Ready - Raj Chheda,"The Paneer Fresta is a mouthwatering Indian delicacy that combines the richness of paneer with a medley of aromatic spices and fresh vegetables, all wrapped in a soft and fluffy Bread & Roti."
Starters,Burmese Vati,"lunch, dinner, Hi-tea",International,International,Vegetarian,pcs,no,yes,no,no,no,yes,yes,no,Ready - Raj Chheda,"Small Baskets stuffed with Burmese spices, fried noodles & roasted peanuts"
Snack,Malvani Vadi Popsicle with Misal & Thecha Pav,"lunch, dinner",Indian,Maharashtrian,Vegetarian,person,no,yes,no,yes,no,no,no,no,Disha Ji,"A unique combination of kothambir vadi served like a popsicle dunked in a Malvani style matki missal, served with thecha covered pav"
Breakfast,Avocado Crepe,breakfast,International,International,Vegetarian,person,no,no,no,no,yes,no,no,yes,Disha Ji,"Batter infused with loads of avocado cooked like a chilla and stuffed with kidney beans, salsa & more avocado"
Snack,Italian Dabeli Jar,"lunch, dinner, Hi-tea",Indian,"Gujarati, Italian",Vegetarian,person,no,no,no,no,no,no,no,no,Disha Ji,Original kutchi Dabeli masala topped with a cheesy Italian sauce served in a mason jar
Breakfast,Pizza Appam with Coconut Chutney,breakfast,Indian,"South Indian, Indian",Vegetarian,person,no,no,no,yes,yes,no,no,no,Mitesh Bhai,"Special  pancake made with fermented Rice & Grains batter and coconut milk topped with tomato concasse, chopped veggies & cheese"
Beverage,Tea (Keshar And Elaichi) And Coffee,Hi-tea,Indian,North Indian,Vegetarian,person,no,no,no,no,no,no,no,no,TC,Fresh brewed cardamom tea infused with pure saffron and regular coffee service
Beverage,Baraat Trolley,"breakfast, Brunch,  lunch, Hi-tea, dinner",Indian,"North Indian, International",Vegetarian,person,yes,no,no,no,no,no,yes,no,TC,"While the baraat proceeds towards the venue for the wedding, a refrigerated trolley moves along with the barat providing them with necessary refreshments while they dance away to the tunes of the occasion. The trolley is made of matt stainless steel and moves along with the baraties. Well-groomed waiters move along with the trolley to facilitate the service of the below-mentioned products."
Starters,Dry Fruit Service (Material By Host),"lunch, dinner, Hi-tea",International,International,Vegetarian,pcs,yes,no,no,no,yes,yes,yes,yes,TC,Assorted dry fruits (material provided by host) is served to guests in bite sized bowls
Starters,Dry Fruit Service (Material By TC),"lunch, dinner, Hi-tea",Indian,Indian,Vegetarian,pcs,yes,no,no,no,yes,yes,yes,yes,TC,Assorted dry fruits (material provided by Trupti Caterers) is served to guests in bite sized bowls
Beverage,Kiwi And Green Apple,"breakfast, Hi-tea",International,International,Vegetarian,person,yes,no,no,no,no,no,no,yes,Dinesh,Fresh Green Apple juice blended with fresh Kiwi juice and pieces
Beverage,Mango Coconut Daiquiri,"lunch, dinner, Hi-tea",International,International,Vegetarian,person,no,no,no,no,no,no,yes,yes,Vijaypal,"A tangy sweet drink made from the Mango Pulp, Coconut Water and topped with Coconut Malai"
Soup,Soup Accompaniments,"lunch, dinner",International,International,Vegetarian,pcs,no,no,yes,no,no,yes,no,no,TC,"Bread Sticks, Bun Bread, Paprika Butter, Herb Butter, Plain Butter"
Soup,Hot Buns Tossed In Butter,"lunch, dinner",International,International,Vegetarian,person,no,no,yes,no,no,no,no,no,TC,
Desserts,Badam Pista Burger,"lunch, dinner, Hi-tea",Indian,"Indian, International",Vegetarian,pcs,no,no,yes,no,no,no,yes,no,Ramlal,In house sweet made of Pistachio and Almond paste in burger style and baked.
Snack,Marwadi Chapata Dahi Wada,"lunch, Hi-tea",Indian,North Indian,Vegetarian,pcs,no,yes,no,no,no,no,no,no,Karigar,Soaked and drained deep fried moong and urad dal vadas topped with snowy dahi and saunth ki chutney
Snack,Roasted Papad,"lunch, dinner, Hi-tea",Indian,North Indian,Vegetarian,pcs,yes,no,yes,no,yes,no,no,yes,TC,
Snack,Khichiya Papad,"lunch, dinner, Hi-tea",Indian,"Gujarati, North Indian",Vegetarian,pcs,yes,yes,no,no,yes,yes,no,yes,#N/A,
Snack,Mug Papad,"lunch, dinner, Hi-tea",Indian,Gujarati,Vegetarian,pcs,yes,yes,no,no,yes,yes,no,yes,TC,
Snack,Chana Papad,"lunch, dinner, Hi-tea",Indian,North Indian,Vegetarian,pcs,yes,no,yes,no,yes,no,no,yes,TC,
Rice and Grains,Cheese Dossa,"lunch, dinner, breakfast",Indian,South Indian,Vegetarian,pcs,no,no,no,no,yes,no,no,no,Mitesh Bhai,"Cheese dosa is a popular  Rice & Grains & lentil crepe topped with sauce or curry, crunchy veggies, fresh herbs and plenty of cheese."
Desserts,Sorbet,"lunch, dinner, Hi-tea",International,International,Vegetarian,gms,yes,no,no,no,no,yes,no,yes,Dhaval Bhai,Sorbet is a frozen dessert made from sweetened water with flavoring. Sorbet is served as a non-fat or low-fat alternative to ice cream.
Snack,Papad Counter,"lunch, dinner",Indian,"North Indian, Gujarati",Vegetarian,pcs,yes,yes,no,no,yes,no,no,yes,TC,Papads are a tasty and convenient snack option that are usually consumed in a meal with as a crunchy element with dal and Rice & Grains
Main Course,Kanda Batata Sambhariya,"lunch, dinner",Indian,Gujarati,Vegetarian,person,no,no,no,no,no,yes,yes,no,Venji Maharaj,"The Kanda Aloo Sambhariya is a Gujarati delicacy, which is very different from the usual, run-of-the-mill subzis. ... Here, the potatoes and onions are stuffed with a masala that comprises besan, coconut, sesame and other Indian spices"
Bread & Roti,Makhmali Paratha,"lunch, dinner",Indian,North Indian,Vegetarian,pcs,no,no,no,no,yes,no,no,no,Venji Maharaj,Enriched flaky refined flour bread cooked over griddle
Salad,Green Salad,"lunch, dinner",International,International,Vegetarian,person,yes,no,no,no,yes,no,no,yes,Sunil / Deepak,
Salad,Som Tom Salad,"lunch, dinner",International,International,Vegetarian,person,no,no,no,no,no,yes,yes,yes,Sunil / Deepak,
Salad,Khimchi Salad,"lunch, dinner",International,International,Vegetarian,person,no,no,no,no,no,yes,no,yes,Sunil / Deepak,
Salad,Russian Salad,"lunch, dinner",International,International,Vegetarian,person,no,no,no,no,no,no,yes,no,Sunil / Deepak,
Salad,Golden Corn Salad,"lunch, dinner",International,International,Vegetarian,person,yes,no,no,no,no,no,no,yes,Sunil / Deepak,
Salad,American Bulbul Salad,"lunch, dinner",International,International,Vegetarian,person,no,no,no,no,no,no,yes,yes,Sunil / Deepak,
Salad,"Green Chutney, Sweet Chutney","lunch, dinner",Indian,"North Indian, Gujarati",Vegetarian,person,yes,no,no,no,yes,yes,no,yes,TC,
Salad,"Keri Achaar, Fried Mirchi","lunch, dinner",Indian,"North Indian, Gujarati",Vegetarian,gms,no,yes,no,no,yes,yes,no,no,TC,
Salad,"Lemon, Salt","lunch, dinner",International,International,Vegetarian,person,yes,no,no,no,yes,yes,no,yes,TC,
Salad,Organic Salad,"lunch, dinner",International,International,Vegetarian,person,yes,no,no,no,yes,no,yes,yes,Sunil / Deepak,We toss a truly  bowl of ‘Salads’ to match the many cuisines we serve. You choose! ‘Accompaniments' are small but magical add-ons that can put a spell on any dish!
Bread & Roti,Bepadi Bread & Roti,"lunch, dinner",Indian,North Indian,Vegetarian,pcs,no,no,no,no,yes,no,no,no,Venji Maharaj,"Poppular Indian flatbread, dry roasted on a flat griddle and then tossed over on the open flame till puffed up. Finished with a dollop of clarified butter."
Desserts,Millenium Kulfi,"lunch, dinner, Hi-tea",Indian,North Indian,Vegetarian,pcs,no,no,no,no,no,no,yes,no,Dhaval Bhai,"Kulfi is a popular Indian ice cream dessert made with mix fruit, milk, sugar, nuts and cardamoms. It is made by evaporating milk and then sweetened with sugar. Flavouring ingredients like saffron and cardamom powder are added along with ground or chopped nuts."
Main Course,Veg Makhmali,"lunch, dinner",Indian,North Indian,Vegetarian,person,no,no,no,no,no,no,no,no,Venji Maharaj,Juliennes of garden fresh vegetables cooked in a rich Tomato gravy
Beverage,Sugarcane Mojito,"lunch, dinner, Hi-tea",International,International,Vegetarian,person,yes,no,no,no,no,no,no,yes,,"Sugarcane Juice, Lime juice and mint leaves topped with sprite"
Starters,Feta Infused Harabhara Kebab,"lunch, dinner, Hi-tea",Indian,North Indian,Vegetarian,pcs,no,yes,no,no,no,no,no,no,Karigar,Delicious Indian snack made with healthy spinach and veggies deep fried and served hot with green chutney
Starters,Bharvan Aloo with Tzatziki,"lunch, dinner",Indian,"North Indian, International",Vegetarian,pcs,no,no,yes,no,yes,no,no,no,,Stuffed Potatoes tossed in Indian spices serve with tzatziki Sauce.
Starters,Orange Pista Shots,"lunch, dinner, Hi-tea",International,International,Vegetarian,pcs,no,no,no,no,no,no,yes,no,,
Snack,Dahi Papdi Snack,"lunch, Hi-tea",Indian,North Indian,Vegetarian,person,no,yes,no,no,no,no,no,no,Vishal Agra,Crushed flat puri’s topped with hung curd and served with crushed potato
Snack,Dahi Pakodi ki Snack,"lunch, dinner, Hi-tea",Indian,North Indian,Vegetarian,pcs,no,yes,no,no,no,no,no,no,Vishal Agra,Small lentil balls topped with chilled dahi saunth and mint chutney
Main Course,Dry Fruit Kofta in Spicy Yellow gravy,"lunch, dinner",Indian,North Indian,Vegetarian,person,no,yes,no,no,no,no,yes,no,Venji Maharaj,Dry fruit stuffed kofta in Spicy Yellow gravy
Bread & Roti,Cheese Chilli Naan,"lunch, dinner",Indian,North Indian,Vegetarian,pcs,no,no,yes,no,yes,no,no,no,Ramesh Singh Naan,Soft refined flour stuff with cheese & chillies cooked in clay oven
Rice and Grains,Kullad Dal Chawal,"lunch, dinner",Indian,North Indian,Vegetarian,person,no,no,no,no,no,no,yes,no,Vijaypal,"A well known wholesome Indian meal consisting layers of dal and Rice & Grains topped with masala peanuts, papad churi, caramalised cabbage and a spoonfull of ghee"
Salad,Keredock Salad,"lunch, dinner",International,International,Vegetarian,person,no,no,no,no,no,yes,no,no,Sunil / Deepak,
Main Course,Vilayati Subz Kolhapuri,"lunch, dinner",Indian,North Indian,Vegetarian,person,no,no,no,no,no,no,no,no,Venji Maharaj,"Baby Corn, Cheery, Tomatos and Tri colour bell pepper cooked in rich spicy tomato based gravy"
